Issue,Subject,Company,Response,Product Area,Status,Request Type,Justification
one of my employee has left. I want to remove them from our hackerrank hiring account,Employee leaving the company,HackerRank,"To remove the employee from your HackerRank hiring account, you need to remove them from their team. Here are the steps:

1. Locate the user in the list.
2. Select the **delete** icon in the **Action** column.

Note: You must have Company Admin or Team Admin access to do this. If the user is the last member of a team and you also need to delete the team itself, you must remove all users before deleting the team.",settings,Replied,product_issue,"Grounded on the 'Manage Team Members' article (hackerrank/settings/teams-management/2203617737-manage-team-members.md) for the removal steps, and the 'Delete a Team' article (hackerrank/settings/teams-management/2181136239-deleting-a-team.md) for the prerequisite access level and note about removing members before team deletion."
i am a professor in a college and wanted to setup a claude lti key for my students,Claude for students,Claude,"To set up the Claude LTI integration for your students, you'll want to follow the Claude LTI setup process in your Canvas LMS. The official guide is intended for Claude for Education administrators and LMS administrators.

You can find the full step-by-step instructions in this article: Set up the Claude LTI in Canvas by Instructure (claude/claude-for-education/11725453-set-up-the-claude-lti-in-canvas-by-instructure.md).

Note: The retrieved chunk only contains the article title and introduction. If you need the detailed configuration steps, please refer directly to that article or contact your Claude for Education account administrator for access to the full setup guide.",claude_for_education,Replied,product_issue,"Grounded on the 'Set up the Claude LTI in Canvas by Instructure' article (claude/claude-for-education/11725453-set-up-the-claude-lti-in-canvas-by-instructure.md). The chunk confirms this article exists and is intended for Claude for Education and LMS administrators, which matches the professor's request. However, the chunk only contains the article header and not the full steps, so the response directs the user to the article and notes the limitation."
"i am in US Virgin Islands and the merchant is saying i have to spend minimum 10$ on my VISA card, why so?",Visa card minimum spend,Visa,"This is actually permitted under Visa's rules. In the USA and US territories — including the US Virgin Islands — merchants are allowed to require a minimum transaction amount of US$10, but only for credit cards. For Visa debit cards, no minimum can be required. If the merchant is imposing a minimum greater than US$10, or is requiring a minimum on a Visa debit card, that would be a violation. In that case, please notify your Visa card issuer to report the issue.",merchant_support,Replied,product_issue,"Grounded on the 'Can a merchant set a maximum or minimum limit for using my Visa card?' article (visa/support.md), which explicitly covers US Virgin Islands as a territory where a US$10 credit card minimum is permitted. Derived_from_top_chunk was 'support'; used 'merchant_support' from canonical_label_set as it is clearly more accurate."
